{
  "version": "v37-site-command-center",
  "productionUrl": "https://montrealai.github.io/goalos-agijobmanager-ascension/",
  "posture": {
    "browserLocal": true,
    "zeroNetwork": true,
    "noWallet": true,
    "noForms": true,
    "noAnalytics": true,
    "noCookies": true,
    "noUserDataWanted": true
  },
  "routes": [
    {
      "id": "command-center",
      "title": "Command Center",
      "href": "index.html",
      "group": "Start",
      "audience": [
        "new",
        "executive",
        "advanced"
      ],
      "time": 2,
      "summary": "The clean front door for every proof surface, journey, boundary, and console."
    },
    {
      "id": "site-atlas",
      "title": "Complete Site Atlas",
      "href": "site-atlas.html",
      "group": "Start",
      "audience": [
        "new",
        "advanced",
        "operator",
        "risk",
        "legal"
      ],
      "time": 3,
      "summary": "Searchable map of every public route, demo, proof room, console, and boundary page."
    },
    {
      "id": "start",
      "title": "Start Here",
      "href": "start.html",
      "group": "Start",
      "audience": [
        "new",
        "executive"
      ],
      "time": 2,
      "summary": "Friendly first-run path for normal users."
    },
    {
      "id": "flight-deck",
      "title": "Ascension Flight Deck",
      "href": "ascension-flight-deck.html",
      "group": "Start",
      "audience": [
        "new",
        "advanced"
      ],
      "time": 5,
      "summary": "Guided journeys, same-origin preview, and public-safe JourneyReceipt export."
    },
    {
      "id": "demo-lab",
      "title": "Demo Lab",
      "href": "demo-lab.html",
      "group": "Start",
      "audience": [
        "new"
      ],
      "time": 4,
      "summary": "Autonomous browser-local demo missions with public-safe dockets."
    },
    {
      "id": "mission-studio",
      "title": "Mission Studio",
      "href": "mission-studio.html",
      "group": "Start",
      "audience": [
        "new",
        "operator"
      ],
      "time": 4,
      "summary": "Compose a local proof pack from a plain-language objective."
    },
    {
      "id": "proof-cards",
      "title": "Proof Cards",
      "href": "proof-cards.html",
      "group": "Start",
      "audience": [
        "new",
        "executive"
      ],
      "time": 3,
      "summary": "Copyable public-safe explanations for sharing GoalOS."
    },
    {
      "id": "until-done",
      "title": "Until-DONE Mission Control",
      "href": "until-done-mission-control.html",
      "group": "Core Proof Loop",
      "audience": [
        "new",
        "advanced"
      ],
      "time": 5,
      "summary": "Objective \u2192 mission contract \u2192 evidence \u2192 governed decision state \u2192 DONE."
    },
    {
      "id": "evidence-docket-composer",
      "title": "Evidence Docket Composer",
      "href": "evidence-docket-composer.html",
      "group": "Core Proof Loop",
      "audience": [
        "new",
        "risk"
      ],
      "time": 5,
      "summary": "Build a claim-bound evidence room before a public claim."
    },
    {
      "id": "trust-equation",
      "title": "Trust Equation Simulator",
      "href": "trust-equation-simulator.html",
      "group": "Core Proof Loop",
      "audience": [
        "new",
        "executive"
      ],
      "time": 4,
      "summary": "Show why zero proof collapses trusted institutional work to zero."
    },
    {
      "id": "proof-settlement",
      "title": "Proof-Settlement Lifecycle",
      "href": "proof-settlement-lifecycle.html",
      "group": "Core Proof Loop",
      "audience": [
        "operator",
        "advanced"
      ],
      "time": 5,
      "summary": "Request \u2192 Escrow \u2192 Execute \u2192 Proof \u2192 Validate \u2192 Settle \u2192 Chronicle."
    },
    {
      "id": "proof-theatre",
      "title": "Proof-to-Action Theatre",
      "href": "proof-to-action-theatre.html",
      "group": "Core Proof Loop",
      "audience": [
        "new"
      ],
      "time": 4,
      "summary": "AI creates output; GoalOS creates proof and decision state."
    },
    {
      "id": "proof-gradient",
      "title": "Proof Gradient Arena",
      "href": "proof-gradient-arena.html",
      "group": "Selection & Evolution",
      "audience": [
        "advanced",
        "operator"
      ],
      "time": 5,
      "summary": "Score is advisory; hard gates decide propagation."
    },
    {
      "id": "constitution",
      "title": "Proof Constitution Simulator",
      "href": "proof-constitution-simulator.html",
      "group": "Selection & Evolution",
      "audience": [
        "advanced",
        "risk"
      ],
      "time": 5,
      "summary": "Aim \u2192 Act \u2192 Prove \u2192 Evolve through typed proof objects and conformance levels."
    },
    {
      "id": "chronicle",
      "title": "Chronicle Compounding Lab",
      "href": "chronicle-compounding-lab.html",
      "group": "Selection & Evolution",
      "audience": [
        "new",
        "advanced"
      ],
      "time": 4,
      "summary": "Accepted proof becomes Chronicle memory and reusable capability."
    },
    {
      "id": "upgrade",
      "title": "Proof-Backed Upgrade Foundry",
      "href": "proof-backed-upgrade-foundry.html",
      "group": "Selection & Evolution",
      "audience": [
        "advanced",
        "operator"
      ],
      "time": 5,
      "summary": "Canary, challenge, rollback, and human-review gates for upgrade rights."
    },
    {
      "id": "artifact",
      "title": "Proof-Carrying Artifact Passport",
      "href": "proof-carrying-artifact-passport.html",
      "group": "Selection & Evolution",
      "audience": [
        "advanced",
        "operator"
      ],
      "time": 5,
      "summary": "Capability may travel only when proof travels with it."
    },
    {
      "id": "multi-agent",
      "title": "Multi-Agent Institution",
      "href": "multi-agent-institution.html",
      "group": "Coordination & Economy",
      "audience": [
        "new",
        "advanced"
      ],
      "time": 5,
      "summary": "Large systems coordinate when proof decides what survives."
    },
    {
      "id": "coordination-lab",
      "title": "Coordination Lab",
      "href": "coordination-lab.html",
      "group": "Coordination & Economy",
      "audience": [
        "advanced"
      ],
      "time": 5,
      "summary": "Compare swarm activity, fixed crews, and proof-governed institutions."
    },
    {
      "id": "coordination-engine",
      "title": "Advanced Coordination Engine",
      "href": "coordination-engine.html",
      "group": "Coordination & Economy",
      "audience": [
        "advanced"
      ],
      "time": 7,
      "summary": "Technical engine for proof-governed coordination."
    },
    {
      "id": "router",
      "title": "Router Observatory",
      "href": "proof-conditioned-router-observatory.html",
      "group": "Coordination & Economy",
      "audience": [
        "advanced",
        "operator"
      ],
      "time": 5,
      "summary": "Route the smallest sufficient validator-bound constellation."
    },
    {
      "id": "inflow",
      "title": "Ascension Inflow Control",
      "href": "ascension-inflow-control.html",
      "group": "Coordination & Economy",
      "audience": [
        "advanced"
      ],
      "time": 5,
      "summary": "Regulated inflow sustains proof-producing institutional work."
    },
    {
      "id": "economy",
      "title": "Sovereign Machine Economy",
      "href": "sovereign-machine-economy.html",
      "group": "Coordination & Economy",
      "audience": [
        "advanced",
        "operator"
      ],
      "time": 6,
      "summary": "The local sovereign machine economy route and proof-first execution posture."
    },
    {
      "id": "mandate",
      "title": "MandateEpoch Clearinghouse",
      "href": "mandate-epoch-clearinghouse.html",
      "group": "Coordination & Economy",
      "audience": [
        "advanced",
        "operator"
      ],
      "time": 5,
      "summary": "Many proof receipts clear into roots, challenge windows, and Chronicle handoff."
    },
    {
      "id": "benchmark",
      "title": "Real-Task Benchmark Bridge",
      "href": "real-task-benchmark-bridge.html",
      "group": "Evidence & Claims",
      "audience": [
        "advanced",
        "research"
      ],
      "time": 5,
      "summary": "Public claims meet real tasks, baselines, cost/risk ledgers, and bounded status."
    },
    {
      "id": "claim-firewall",
      "title": "Claim Boundary Firewall",
      "href": "claim-boundary-firewall.html",
      "group": "Evidence & Claims",
      "audience": [
        "risk",
        "new"
      ],
      "time": 4,
      "summary": "Claims advance only if evidence survives the firewall."
    },
    {
      "id": "replay",
      "title": "Replay & Falsification Gauntlet",
      "href": "replay-falsification-gauntlet.html",
      "group": "Evidence & Claims",
      "audience": [
        "risk",
        "advanced"
      ],
      "time": 5,
      "summary": "Replay the proof package and attack it before stronger claims advance."
    },
    {
      "id": "experience",
      "title": "Sovereign Experience Stream",
      "href": "sovereign-experience-stream.html",
      "group": "Evidence & Claims",
      "audience": [
        "advanced"
      ],
      "time": 5,
      "summary": "Validated experience becomes governed learning, not unbounded policy update."
    },
    {
      "id": "action-graph",
      "title": "Action Graph Handoff",
      "href": "action-graph-handoff.html",
      "group": "Action & Review",
      "audience": [
        "operator",
        "advanced"
      ],
      "time": 5,
      "summary": "Decision state becomes scoped, rollback-ready action state."
    },
    {
      "id": "operator",
      "title": "Read-Only Operator Console",
      "href": "operator-console.html",
      "group": "Action & Review",